{
  "design_id": "amp_low_voltage_audio",
  "board_id": "amp_low_voltage_audio",
  "components": [
    {
      "refdes": "JSEC",
      "role": "low-voltage isolated secondary input connector",
      "selected_symbol": "Connector:Conn_01x02_Pin",
      "selected_footprint": "Connector_PinHeader_2.54mm:PinHeader_1x02_P2.54mm_Vertical",
      "manufacturer_part_number": "Molex-22-23-2021",
      "source_evidence": [{ "kind": "datasheet", "reference": "Molex KK 254 vertical header datasheet" }],
      "pins": [
        { "component_refdes": "JSEC", "pin_number": "1", "canonical_name": "AC1", "electrical_type": "passive", "symbol_pin": "Pin_1", "footprint_pad": "1" },
        { "component_refdes": "JSEC", "pin_number": "2", "canonical_name": "AC2", "electrical_type": "passive", "symbol_pin": "Pin_2", "footprint_pad": "2" }
      ]
    },
    {
      "refdes": "BR1",
      "role": "low-voltage bridge rectifier for isolated secondary rail distribution",
      "selected_symbol": "Device:D_Bridge_+-AA",
      "selected_footprint": "Diode_THT:Diode_Bridge_Round_D9.0mm",
      "manufacturer_part_number": "KBU4G",
      "source_evidence": [{ "kind": "datasheet", "reference": "KBU bridge rectifier datasheet" }],
      "pins": [
        { "component_refdes": "BR1", "pin_number": "1", "canonical_name": "AC1", "electrical_type": "passive", "symbol_pin": "AC1", "footprint_pad": "1" },
        { "component_refdes": "BR1", "pin_number": "2", "canonical_name": "AC2", "electrical_type": "passive", "symbol_pin": "AC2", "footprint_pad": "2" },
        { "component_refdes": "BR1", "pin_number": "3", "canonical_name": "PLUS", "electrical_type": "power", "symbol_pin": "+", "footprint_pad": "3" },
        { "component_refdes": "BR1", "pin_number": "4", "canonical_name": "MINUS", "electrical_type": "power", "symbol_pin": "-", "footprint_pad": "4" }
      ]
    },
    {
      "refdes": "CRES1",
      "role": "low-voltage rail reservoir capacitor",
      "selected_symbol": "Device:CP",
      "selected_footprint": "Capacitor_THT:CP_Radial_D18.0mm_P7.50mm",
      "manufacturer_part_number": "Nichicon-UHE1V103MHD",
      "source_evidence": [{ "kind": "datasheet", "reference": "Nichicon UHE aluminum electrolytic capacitor datasheet" }],
      "pins": [
        { "component_refdes": "CRES1", "pin_number": "1", "canonical_name": "PLUS", "electrical_type": "passive", "symbol_pin": "1", "footprint_pad": "1" },
        { "component_refdes": "CRES1", "pin_number": "2", "canonical_name": "MINUS", "electrical_type": "passive", "symbol_pin": "2", "footprint_pad": "2" }
      ]
    },
    {
      "refdes": "JIN",
      "role": "input jack for guitar signal",
      "selected_symbol": "Connector:AudioJack2",
      "selected_footprint": "Connector_Audio:Jack_6.35mm",
      "manufacturer_part_number": "Switchcraft-12A",
      "source_evidence": [{ "kind": "datasheet", "reference": "Switchcraft open-frame jack catalog" }],
      "pins": [
        { "component_refdes": "JIN", "pin_number": "1", "canonical_name": "TIP", "electrical_type": "passive", "symbol_pin": "T", "footprint_pad": "1" },
        { "component_refdes": "JIN", "pin_number": "2", "canonical_name": "SLEEVE", "electrical_type": "passive", "symbol_pin": "S", "footprint_pad": "2" }
      ]
    },
    {
      "refdes": "RIN",
      "role": "input jack pulldown resistor",
      "selected_symbol": "Device:R",
      "selected_footprint": "Resistor_THT:R_Axial_DIN0207_L6.3mm_D2.5mm_P10.16mm_Horizontal",
      "manufacturer_part_number": "Yageo-MFR-25FBF52-1M",
      "source_evidence": [{ "kind": "datasheet", "reference": "Yageo MFR resistor datasheet" }],
      "pins": [
        { "component_refdes": "RIN", "pin_number": "1", "canonical_name": "A", "electrical_type": "passive", "symbol_pin": "1", "footprint_pad": "1" },
        { "component_refdes": "RIN", "pin_number": "2", "canonical_name": "B", "electrical_type": "passive", "symbol_pin": "2", "footprint_pad": "2" }
      ]
    },
    {
      "refdes": "CIN",
      "role": "preamp input coupling capacitor",
      "selected_symbol": "Device:C",
      "selected_footprint": "Capacitor_THT:C_Disc_D5.0mm_W2.5mm_P5.00mm",
      "manufacturer_part_number": "Kemet-C322C104K5R5TA",
      "source_evidence": [{ "kind": "datasheet", "reference": "Kemet ceramic capacitor datasheet" }],
      "pins": [
        { "component_refdes": "CIN", "pin_number": "1", "canonical_name": "A", "electrical_type": "passive", "symbol_pin": "1", "footprint_pad": "1" },
        { "component_refdes": "CIN", "pin_number": "2", "canonical_name": "B", "electrical_type": "passive", "symbol_pin": "2", "footprint_pad": "2" }
      ]
    },
    {
      "refdes": "QPRE1",
      "role": "discrete preamp JFET gain stage",
      "selected_symbol": "Device:Q_NJFET_DSG",
      "selected_footprint": "Package_TO_SOT_THT:TO-92_Inline_DSG",
      "manufacturer_part_number": "J113",
      "source_evidence": [{ "kind": "datasheet", "reference": "onsemi J113 JFET datasheet" }],
      "pins": [
        { "component_refdes": "QPRE1", "pin_number": "1", "canonical_name": "D", "electrical_type": "power", "symbol_pin": "D", "footprint_pad": "1" },
        { "component_refdes": "QPRE1", "pin_number": "2", "canonical_name": "S", "electrical_type": "passive", "symbol_pin": "S", "footprint_pad": "2" },
        { "component_refdes": "QPRE1", "pin_number": "3", "canonical_name": "G", "electrical_type": "input", "symbol_pin": "G", "footprint_pad": "3" }
      ]
    },
    {
      "refdes": "RPRE_D",
      "role": "preamp drain load resistor",
      "selected_symbol": "Device:R",
      "selected_footprint": "Resistor_THT:R_Axial_DIN0207_L6.3mm_D2.5mm_P10.16mm_Horizontal",
      "manufacturer_part_number": "Yageo-MFR-25FBF52-33K",
      "source_evidence": [{ "kind": "datasheet", "reference": "Yageo MFR resistor datasheet" }],
      "pins": [
        { "component_refdes": "RPRE_D", "pin_number": "1", "canonical_name": "A", "electrical_type": "passive", "symbol_pin": "1", "footprint_pad": "1" },
        { "component_refdes": "RPRE_D", "pin_number": "2", "canonical_name": "B", "electrical_type": "passive", "symbol_pin": "2", "footprint_pad": "2" }
      ]
    },
    {
      "refdes": "RPRE_S",
      "role": "preamp source bias resistor",
      "selected_symbol": "Device:R",
      "selected_footprint": "Resistor_THT:R_Axial_DIN0207_L6.3mm_D2.5mm_P10.16mm_Horizontal",
      "manufacturer_part_number": "Yageo-MFR-25FBF52-1K5",
      "source_evidence": [{ "kind": "datasheet", "reference": "Yageo MFR resistor datasheet" }],
      "pins": [
        { "component_refdes": "RPRE_S", "pin_number": "1", "canonical_name": "A", "electrical_type": "passive", "symbol_pin": "1", "footprint_pad": "1" },
        { "component_refdes": "RPRE_S", "pin_number": "2", "canonical_name": "B", "electrical_type": "passive", "symbol_pin": "2", "footprint_pad": "2" }
      ]
    },
    {
      "refdes": "CPRE_BYP",
      "role": "preamp source bypass capacitor",
      "selected_symbol": "Device:C",
      "selected_footprint": "Capacitor_THT:C_Disc_D5.0mm_W2.5mm_P5.00mm",
      "manufacturer_part_number": "Kemet-C322C105K5R5TA",
      "source_evidence": [{ "kind": "datasheet", "reference": "Kemet ceramic capacitor datasheet" }],
      "pins": [
        { "component_refdes": "CPRE_BYP", "pin_number": "1", "canonical_name": "A", "electrical_type": "passive", "symbol_pin": "1", "footprint_pad": "1" },
        { "component_refdes": "CPRE_BYP", "pin_number": "2", "canonical_name": "B", "electrical_type": "passive", "symbol_pin": "2", "footprint_pad": "2" }
      ]
    },
    {
      "refdes": "CTONE_IN",
      "role": "3-band tone circuit input coupling capacitor",
      "selected_symbol": "Device:C",
      "selected_footprint": "Capacitor_THT:C_Disc_D5.0mm_W2.5mm_P5.00mm",
      "manufacturer_part_number": "Kemet-C322C104K5R5TA",
      "source_evidence": [{ "kind": "datasheet", "reference": "Kemet ceramic capacitor datasheet" }],
      "pins": [
        { "component_refdes": "CTONE_IN", "pin_number": "1", "canonical_name": "A", "electrical_type": "passive", "symbol_pin": "1", "footprint_pad": "1" },
        { "component_refdes": "CTONE_IN", "pin_number": "2", "canonical_name": "B", "electrical_type": "passive", "symbol_pin": "2", "footprint_pad": "2" }
      ]
    },
    {
      "refdes": "RBASS",
      "role": "3-band tone bass resistor",
      "selected_symbol": "Device:R",
      "selected_footprint": "Resistor_THT:R_Axial_DIN0207_L6.3mm_D2.5mm_P10.16mm_Horizontal",
      "manufacturer_part_number": "Yageo-MFR-25FBF52-100K",
      "source_evidence": [{ "kind": "datasheet", "reference": "Yageo MFR resistor datasheet" }],
      "pins": [
        { "component_refdes": "RBASS", "pin_number": "1", "canonical_name": "A", "electrical_type": "passive", "symbol_pin": "1", "footprint_pad": "1" },
        { "component_refdes": "RBASS", "pin_number": "2", "canonical_name": "B", "electrical_type": "passive", "symbol_pin": "2", "footprint_pad": "2" }
      ]
    },
    {
      "refdes": "CBASS",
      "role": "3-band tone bass capacitor",
      "selected_symbol": "Device:C",
      "selected_footprint": "Capacitor_THT:C_Disc_D5.0mm_W2.5mm_P5.00mm",
      "manufacturer_part_number": "Kemet-C322C223K5R5TA",
      "source_evidence": [{ "kind": "datasheet", "reference": "Kemet ceramic capacitor datasheet" }],
      "pins": [
        { "component_refdes": "CBASS", "pin_number": "1", "canonical_name": "A", "electrical_type": "passive", "symbol_pin": "1", "footprint_pad": "1" },
        { "component_refdes": "CBASS", "pin_number": "2", "canonical_name": "B", "electrical_type": "passive", "symbol_pin": "2", "footprint_pad": "2" }
      ]
    },
    {
      "refdes": "RMID",
      "role": "3-band tone mid resistor",
      "selected_symbol": "Device:R",
      "selected_footprint": "Resistor_THT:R_Axial_DIN0207_L6.3mm_D2.5mm_P10.16mm_Horizontal",
      "manufacturer_part_number": "Yageo-MFR-25FBF52-22K",